composer,merged,cities,lower_bounds_list,lower_bounds,lower_bounds_val
per musica di Filippo Livigni. Da,"[{'Verona': ['1781', ""I viaggiatori felici dramma giocoso per musica di Filippo Livigni. Da rappresentarsi nel Teatro dell'Accademia Vecchia la primavera dell'anno 1781. Dedicato a sua eccellenza co. Mario Savorgnan capitan., e v. pod. di Verona e a sua eccellenza Elisabetta Grimani Savorgnana""]}, {'Venice': ['1773', ""La serva per amore, dramma giocoso per musica di Filippo Livigni. Da rappresentarsi nel Teatro di San Samuele l'autunno dell'anno 1773""]}]","{'Verona', 'Venice'}","{'1760': [[1781, 'Verona'], [1773, 'Venice']]}",1760,"[[1781, 'Verona'], [1773, 'Venice']]"
per musica di Gaetano Rossi da ra,"[{'Padova': ['1802', ""Amore e paura ossia Il conte Pimpinella farsa giocosa per musica di Gaetano Rossi da rappresentarsi nel nobilissimo nuovo Teatro di Padova l'autunno dell'anno 1802 dedicata alli nobilissimi signori Presidenti di detto teatro""]}, {'Venice': ['1799', ""L' Accademia di musica farsa giocosa per musica di Gaetano Rossi da rappresentarsi nel nobilissimo Teatro a San Samuele l'autunno dell'anno 1799""]}, {'Venice': ['1800', 'Gli Sciti dramma per musica di Gaetano Rossi da rappresentarsi nel nobilissimo Teatro La Fenice nel carnevale 1800']}, {'Venice': ['1799', ""La pazza giornata ovvero il matrimonio di Figaro dramma comico per musica di Gaetano Rossi da rappresentarsi nel nobilissimo Teatro Venier in San Benedetto il carovale dell'anno 1800""]}]","{'Padova', 'Venice'}","{'1782': [[1802, 'Padova'], [1799, 'Venice'], [1800, 'Venice'], [1799, 'Venice']]}",1782,"[[1802, 'Padova'], [1799, 'Venice'], [1800, 'Venice'], [1799, 'Venice']]"
per musica di Giuseppe Foppa da r,"[{'Venice': ['1803', ""L' amante anonimo, farsa giocosa per musica di Giuseppe Foppa da rappresentarsi nel nobilissimo Teatro in San Moise' l'autunno dell'anno 1803""]}, {'Venice': ['1812', ""L' inganno felice farsa per musica di Giuseppe Foppa da rappresentarsi nel Teatro Giustiniani in San Mose la primavera 1812""]}, {'Fano': ['1798', ""L' equivoco in equivoco.  Dramma giocoso per musica di Giuseppe Foppa da rappresentarsi nel nobilissimo Teatro in Verona. Umiliato a sua Eccellenza il Signor Guglielmo Barone di Kerpen Ciambelano, Attuale Cavaliere comandante l'ordine Teutonico, Luogotenente generale, Colonello proprietario d'un Reggimento d'Infanteria, e Comandante generale del Veronese per Sua Maestà l'Imperatore.""]}, {'Venice': ['1805', ""Amare e non voler essere amante ossia L'abitatore del bosco, dramma eroicomico in due atti per musica di Giuseppe Foppa da rappresentarsi nel nobilissimo Teatro La Fenice la primavera dell'anno 1805""]}, {'Venice': ['1806', ""Il testamento e seicentomille franchi farsa giocosa per musica di Giuseppe Foppa da rappresentarsi nel nobilissimo Teatro Giustiniani in S. Moise' l'autunno dell'anno 1806""]}, {'Venice': ['1815', ""Sigismondo dramma per musica di Giuseppe Foppa da rappresentarsi nel Gran Teatro la Fenice il carnovale dell'anno 1815""]}, {'Venice': ['1807', ""L' amico dell'uomo farsa giocosa per musica di Giuseppe Foppa da rappresentarsi nel nobilissimo teatro Giustiniani in S. Moise' il carnovale dell'anno 1807""]}]","{'Fano', 'Venice'}","{'1782': [[1803, 'Venice'], [1798, 'Fano']]}",1782,"[[1803, 'Venice'], [1798, 'Fano']]"
per musica di Pietro Metastasio f,"[{'Perugia': ['1734', ""Artaserse dramma per musica di Pietro Metastasio fra gli Arcadi Artino Corasio, e poeta di S.M.C. e C. da rappresentarsi in Perugia nel Teatro de' Nobili detto del Pavone nel carnevale dell'anno 1734. Dedicato alle dame della medesima città""]}, {'Lodi': ['1730', ""Alessandro nell'Indie drama per musica di Pietro Metastasio fra gli Arcadi Artino Corasio. Da rappresentarsi nel Teatro detto delle Dame nel carnevale dell'anno 1730. Dedicato alla maestà di Giacomo 3. re della Gran Brettagna &c.""]}]","{'Perugia', 'Lodi'}","{'1716': [[1734, 'Perugia'], [1730, 'Lodi']]}",1716,"[[1734, 'Perugia'], [1730, 'Lodi']]"
per musica di Polisseno Fegejo P.,"[{'Venice': ['1760', ""Filosofia ed amore, dramma giocoso per musica di Polisseno Fegejo P.A. da rappresentarsi nel Teatro Giustinian di S. Moisè il carnovale dell'anno 1760""]}, {'Venice': ['1760', ""Amor contadino, dramma giocoso per musica di Polisseno Fegejo P. A. da rappresentarsi nel Teatro di Sant'Angelo l'autunno dell'anno 1760""]}, {'Bologna': ['1760', ""La buona figliuola dramma giocoso per musica di Polisseno Fegejo P.A. da rappresentarsi nel Teatro Formagliari la primavera dell'anno 1761. Dedicato alle nobilissime, e gentilissime dame, e cavalieri di Bologna""]}]","{'Bologna', 'Venice'}","{'1760': [[1760, 'Venice'], [1760, 'Venice'], [1760, 'Bologna']]}",1760,"[[1760, 'Venice'], [1760, 'Venice'], [1760, 'Bologna']]"
